<?xml version="1.0"?>
<!-- just a sanity check: body collision rewritten to xml -->
<configuration xmlns:xsi="http://www.w3.org/2001/XMLSchema-instance"
    xsi:noNamespaceSchemaLocation="simulation_schema.xsd">
    <fps>24</fps>
    <video_length>30</video_length>
    <delta_t>0.0005</delta_t>
    <end_time>20.0</end_time>

    <!-- missing parameters for 'domain_size' and 'cutoff_radius' -->
    <!-- enable selection between direct sum or linked cells container, (active or implicit) -->

    <cuboid>
        <position>
            <x>20.0</x>
            <y>20.0</y>
            <z>0.0</z>
        </position>
        <grid_dim>
            <dimx>100</dimx>
            <dimy>20</dimy>
            <dimz>1</dimz>
        </grid_dim>
        <grid_spacing>1.1225</grid_spacing>
        <temperature>0.1</temperature>          <!-- aka mean brownian motion -->
        <mass>1</mass>
        <velocity>
            <x>0.0</x>
            <y>0.0</y>
            <z>0.0</z>
        </velocity>
        <type>0</type>
    </cuboid>

    <cuboid>
        <position>
            <x>70.0</x>
            <y>60.0</y>
            <z>0.0</z>
        </position>
        <grid_dim>
            <dimx>20</dimx>
            <dimy>20</dimy>
            <dimz>1</dimz>
        </grid_dim>
        <grid_spacing>1.1225</grid_spacing>
        <temperature>0.1</temperature>          <!-- aka mean brownian motion -->
        <mass>1</mass>
        <velocity>
            <x>0.0</x>
            <y>-10.0</y>
            <z>0.0</z>
        </velocity>
        <type>1</type>
    </cuboid>

</configuration>