<?xml version="1.0"?>
<!-- just a sanity check: body collision rewritten to xml -->
<configuration xmlns:xsi="http://www.w3.org/2001/XMLSchema-instance"
               xsi:noNamespaceSchemaLocation="../../input/simulation_schema.xsd">
    <fps>24</fps>
    <video_length>10</video_length>
    <delta_t>0.0014</delta_t>
    <end_time>100.0</end_time>

    <output_format>XYZ</output_format>
    <directsum_container></directsum_container>
    <cuboid>
        <position>
            <x>0.0</x>
            <y>0.0</y>
            <z>0.0</z>
        </position>
        <grid_dim>
            <dimx>10</dimx>
            <dimy>2</dimy>
            <dimz>4</dimz>
        </grid_dim>
        <grid_spacing>2</grid_spacing>
        <temperature>2.2</temperature>          <!-- aka mean brownian motion -->
        <mass>1</mass>
        <velocity>
            <x>0.0</x>
            <y>0.0</y>
            <z>0.0</z>
        </velocity>
        <type>0</type>
    </cuboid>

    <cuboid>
        <position>
            <x>100.0</x>
            <y>20.0</y>
            <z>20.0</z>
        </position>
        <grid_dim>
            <dimx>3</dimx>
            <dimy>3</dimy>
            <dimz>3</dimz>
        </grid_dim>
        <grid_spacing>5</grid_spacing>
        <temperature>1</temperature>          <!-- aka mean brownian motion -->
        <mass>1.5</mass>
        <velocity>
            <x>-10.0</x>
            <y>-10.0</y>
            <z>0.0</z>
        </velocity>
        <type>2</type>
    </cuboid>

    <cuboid>
        <position>
            <x>20.0</x>
            <y>100.0</y>
            <z>100.0</z>
        </position>
        <grid_dim>
            <dimx>1</dimx>
            <dimy>1</dimy>
            <dimz>1</dimz>
        </grid_dim>
        <grid_spacing>3</grid_spacing>
        <temperature>10</temperature>          <!-- aka mean brownian motion -->
        <mass>100</mass>
        <velocity>
            <x>15.0</x>
            <y>15.0</y>
            <z>15.0</z>
        </velocity>
        <type>10</type>
    </cuboid>

</configuration>